{
  "schema": "verifiers/totalsegmentator_quality_v1/validators/output_schema.json",
  "preflight_status": "passed",
  "preflight": [
    {
      "name": "fixture_exists",
      "path": "runs/totalsegmentator_trusted_pass_current/skill_run",
      "status": "passed"
    },
    {
      "name": "fixture_is_directory",
      "path": "runs/totalsegmentator_trusted_pass_current/skill_run",
      "status": "passed"
    }
  ],
  "schema_status": "passed",
  "sanity_status": "passed",
  "sanity_results": [
    {
      "check": {
        "path": "verifier.id",
        "eq": "medagent.verifiers.totalsegmentator_quality_v1"
      },
      "actual": "medagent.verifiers.totalsegmentator_quality_v1",
      "ok": true,
      "reason": "'medagent.verifiers.totalsegmentator_quality_v1' == 'medagent.verifiers.totalsegmentator_quality_v1'"
    },
    {
      "check": {
        "path": "target.skill_id",
        "contains_any_of": [
          "totalsegmentator",
          "medagent.totalsegmentator"
        ]
      },
      "actual": "medagent.totalsegmentator",
      "ok": true,
      "reason": "matched 'totalsegmentator'"
    },
    {
      "check": {
        "path": "artifact_inventory.label_map_readable",
        "eq": true
      },
      "actual": true,
      "ok": true,
      "reason": "True == True"
    },
    {
      "check": {
        "path": "artifact_inventory.affine_match",
        "eq": true
      },
      "actual": true,
      "ok": true,
      "reason": "True == True"
    },
    {
      "check": {
        "path": "artifact_inventory.shape_match",
        "eq": true
      },
      "actual": true,
      "ok": true,
      "reason": "True == True"
    },
    {
      "check": {
        "path": "anatomy_plausibility.verdict",
        "eq": "pass"
      },
      "actual": "pass",
      "ok": true,
      "reason": "'pass' == 'pass'"
    },
    {
      "check": {
        "path": "anatomy_plausibility.classes_failing_volume_bounds",
        "length_eq": 0
      },
      "actual": [],
      "ok": true,
      "reason": "len=0 == 0"
    },
    {
      "check": {
        "path": "anatomy_plausibility.classes_overfragmented",
        "length_eq": 0
      },
      "actual": [],
      "ok": true,
      "reason": "len=0 == 0"
    },
    {
      "check": {
        "path": "label_set_subset.verdict",
        "contains_any_of": [
          "pass",
          "skipped"
        ]
      },
      "actual": "skipped",
      "ok": true,
      "reason": "matched 'skipped'"
    },
    {
      "check": {
        "path": "gt_metrics.acceptable",
        "eq": true
      },
      "actual": true,
      "ok": true,
      "reason": "True == True"
    },
    {
      "check": {
        "path": "overall",
        "eq": "pass"
      },
      "actual": "pass",
      "ok": true,
      "reason": "'pass' == 'pass'"
    }
  ],
  "runtime_status": "within_envelope",
  "runtime_reason": null,
  "cost_status": "skipped",
  "cost_results": [],
  "env_pin_status": "skipped",
  "env_pin_results": [],
  "factual_echo_status": "skipped",
  "factual_echo_results": [],
  "model_identity_status": "skipped",
  "model_identity_results": [],
  "runtime_integrity_status": "skipped",
  "runtime_integrity_findings": [],
  "overall_status": "passed",
  "integrity_status": "clean",
  "integrity_n_findings": 0,
  "errors": [],
  "parse_error": null,
  "exit_code": 0,
  "stderr_excerpt": ""
}