{
  "schema": "verifiers/nv_reason_cxr_quality_v1/validators/output_schema.json",
  "preflight_status": "passed",
  "preflight": [
    {
      "name": "fixture_exists",
      "path": "examples/evidence_packs/nv_reason_cxr_trusted_mock_pass/skill_run",
      "status": "passed"
    },
    {
      "name": "fixture_is_directory",
      "path": "examples/evidence_packs/nv_reason_cxr_trusted_mock_pass/skill_run",
      "status": "passed"
    }
  ],
  "schema_status": "passed",
  "sanity_status": "passed",
  "sanity_results": [
    {
      "check": {
        "path": "verifier.id",
        "eq": "medagent.verifiers.nv_reason_cxr_quality_v1"
      },
      "actual": "medagent.verifiers.nv_reason_cxr_quality_v1",
      "ok": true,
      "reason": "'medagent.verifiers.nv_reason_cxr_quality_v1' == 'medagent.verifiers.nv_reason_cxr_quality_v1'"
    },
    {
      "check": {
        "path": "target.skill_id",
        "eq": "medagent.nv_reason_cxr"
      },
      "actual": "medagent.nv_reason_cxr",
      "ok": true,
      "reason": "'medagent.nv_reason_cxr' == 'medagent.nv_reason_cxr'"
    },
    {
      "check": {
        "path": "target.source_overall_status",
        "eq": "passed"
      },
      "actual": "passed",
      "ok": true,
      "reason": "'passed' == 'passed'"
    },
    {
      "check": {
        "path": "cxr_quality.acceptable",
        "eq": true
      },
      "actual": true,
      "ok": true,
      "reason": "True == True"
    },
    {
      "check": {
        "path": "cxr_quality.mock_mode",
        "eq": true
      },
      "actual": true,
      "ok": true,
      "reason": "True == True"
    },
    {
      "check": {
        "path": "cxr_quality.forbidden_finding_count",
        "eq": 0
      },
      "actual": 0,
      "ok": true,
      "reason": "0 == 0"
    },
    {
      "check": {
        "path": "cxr_quality.case_id",
        "eq": "synthetic-cxr-smoke"
      },
      "actual": "synthetic-cxr-smoke",
      "ok": true,
      "reason": "'synthetic-cxr-smoke' == 'synthetic-cxr-smoke'"
    },
    {
      "check": {
        "path": "cxr_quality.image_format",
        "eq": "png"
      },
      "actual": "png",
      "ok": true,
      "reason": "'png' == 'png'"
    },
    {
      "check": {
        "path": "cxr_quality.image_sha256",
        "matches": "^[0-9a-f]{64}$"
      },
      "actual": "767c7ad1c4e799c0b177015970ef7dafa7feedcfad11e03c992146cffb6569cf",
      "ok": true,
      "reason": "matched '^[0-9a-f]{64}$'"
    },
    {
      "check": {
        "path": "cxr_quality.model",
        "eq": "nvidia/NV-Reason-CXR-3B"
      },
      "actual": "nvidia/NV-Reason-CXR-3B",
      "ok": true,
      "reason": "'nvidia/NV-Reason-CXR-3B' == 'nvidia/NV-Reason-CXR-3B'"
    },
    {
      "check": {
        "path": "overall",
        "eq": "pass"
      },
      "actual": "pass",
      "ok": true,
      "reason": "'pass' == 'pass'"
    }
  ],
  "runtime_status": "within_envelope",
  "runtime_reason": null,
  "cost_status": "skipped",
  "cost_results": [],
  "env_pin_status": "skipped",
  "env_pin_results": [],
  "factual_echo_status": "skipped",
  "factual_echo_results": [],
  "model_identity_status": "skipped",
  "model_identity_results": [],
  "runtime_integrity_status": "skipped",
  "runtime_integrity_findings": [],
  "overall_status": "passed",
  "integrity_status": "clean",
  "integrity_n_findings": 0,
  "errors": [],
  "parse_error": null,
  "exit_code": 0,
  "stderr_excerpt": ""
}