{
  "schema": "skills/radiology-note-summarizer/validators/output_schema.json",
  "preflight_status": "passed",
  "preflight": [
    {
      "name": "fixture_exists",
      "path": "skills/radiology-note-summarizer/fixtures/case_001_input.json",
      "status": "passed"
    },
    {
      "name": "fixture_is_file",
      "path": "skills/radiology-note-summarizer/fixtures/case_001_input.json",
      "status": "passed"
    }
  ],
  "schema_status": "passed",
  "sanity_status": "failed",
  "sanity_results": [
    {
      "check": {
        "path": "output.study_instance_uid",
        "matches": "^[0-9.]+$"
      },
      "actual": "1.2.826.0.1.3680043.8.498.79927183420192038472634851012345",
      "ok": true,
      "reason": "matched '^[0-9.]+$'"
    },
    {
      "check": {
        "path": "output.findings",
        "length_gte": 1
      },
      "actual": [
        "mild hepatic steatosis on CT abdomen",
        "small simple cyst in the right kidney on CT",
        "no acute findings on CT abdomen"
      ],
      "ok": true,
      "reason": "len=3 >= 1"
    },
    {
      "check": {
        "path": "output.impressions",
        "matches": ".+"
      },
      "actual": "CT abdomen with contrast shows mild hepatic steatosis and a small simple cyst in the right kidney, no acute findings",
      "ok": true,
      "reason": "matched '.+'"
    },
    {
      "check": {
        "path": "output.flags_for_followup",
        "exists": true
      },
      "actual": [
        "if symptoms persist"
      ],
      "ok": true,
      "reason": "present (expected)"
    },
    {
      "check": {
        "path": "runtime.model",
        "eq": "nvidia/openai/gpt-oss-20b"
      },
      "actual": "nvidia/meta/llama-3.3-70b-instruct",
      "ok": false,
      "reason": "'nvidia/meta/llama-3.3-70b-instruct' != 'nvidia/openai/gpt-oss-20b'"
    },
    {
      "check": {
        "path": "runtime.temperature",
        "eq": 0.0
      },
      "actual": 0.0,
      "ok": true,
      "reason": "0.0 == 0.0"
    },
    {
      "check": {
        "path": "runtime.endpoint",
        "eq": "https://inference-api.nvidia.com/v1"
      },
      "actual": "https://inference-api.nvidia.com/v1",
      "ok": true,
      "reason": "'https://inference-api.nvidia.com/v1' == 'https://inference-api.nvidia.com/v1'"
    }
  ],
  "runtime_status": "within_envelope",
  "runtime_reason": null,
  "cost_status": "passed",
  "cost_results": [
    {
      "key": "wall_seconds",
      "actual": 3.086890703998506,
      "min": null,
      "max": 60,
      "ok": true,
      "reason": null,
      "source": "measured"
    },
    {
      "key": "cpu_seconds",
      "actual": 0.274374,
      "min": null,
      "max": 10,
      "ok": true,
      "reason": null,
      "source": "measured"
    },
    {
      "key": "rss_mb_peak",
      "actual": 30.5,
      "min": null,
      "max": 500,
      "ok": true,
      "reason": null,
      "source": "measured"
    },
    {
      "key": "gpu_seconds",
      "actual": 0.0,
      "min": null,
      "max": 0,
      "ok": true,
      "reason": null,
      "source": "measured"
    },
    {
      "key": "gpu_memory_mb_peak",
      "actual": 0.0,
      "min": null,
      "max": 0,
      "ok": true,
      "reason": null,
      "source": "measured"
    },
    {
      "key": "llm_tokens_input",
      "actual": 556,
      "min": 50,
      "max": 4000,
      "ok": true,
      "reason": null,
      "source": "self_reported"
    },
    {
      "key": "llm_tokens_output",
      "actual": 128,
      "min": 20,
      "max": 1024,
      "ok": true,
      "reason": null,
      "source": "self_reported"
    }
  ],
  "factual_echo_status": "passed",
  "factual_echo_results": [
    {
      "input_path": "dicom_metadata.StudyInstanceUID",
      "mode": "exact",
      "output_paths": [
        "output.study_instance_uid"
      ],
      "input_value": "1.2.826.0.1.3680043.8.498.79927183420192038472634851012345",
      "case_insensitive": false,
      "ok": true,
      "reason": "input='1.2.826.0.1.3680043.8.498.79927183420192038472634851012345' in ['output.study_instance_uid']"
    },
    {
      "input_path": "dicom_metadata.Modality",
      "mode": "any_contains",
      "output_paths": [
        "output.findings",
        "output.impressions"
      ],
      "input_value": "CT",
      "case_insensitive": true,
      "ok": true,
      "reason": "'CT' found in ['output.findings', 'output.impressions']"
    },
    {
      "input_path": "dicom_metadata.BodyPartExamined",
      "mode": "any_contains",
      "output_paths": [
        "output.findings",
        "output.impressions"
      ],
      "input_value": "ABDOMEN",
      "case_insensitive": true,
      "ok": true,
      "reason": "'ABDOMEN' found in ['output.findings', 'output.impressions']"
    }
  ],
  "model_identity_status": "failed",
  "model_identity_results": [
    {
      "field": "model",
      "declared": "nvidia/openai/gpt-oss-20b",
      "actual": "nvidia/meta/llama-3.3-70b-instruct",
      "ok": false,
      "reason": "'nvidia/meta/llama-3.3-70b-instruct' != 'nvidia/openai/gpt-oss-20b'"
    },
    {
      "field": "endpoint",
      "declared": "https://inference-api.nvidia.com/v1",
      "actual": "https://inference-api.nvidia.com/v1",
      "ok": true,
      "reason": "'https://inference-api.nvidia.com/v1' == 'https://inference-api.nvidia.com/v1'"
    },
    {
      "field": "temperature",
      "declared": 0.0,
      "actual": 0.0,
      "ok": true,
      "reason": "0.0 == 0.0"
    }
  ],
  "runtime_integrity_status": "clean",
  "runtime_integrity_findings": [],
  "overall_status": "failed (sanity/runtime/integrity/cost/factual_echo/model_identity gate)",
  "integrity_status": "clean",
  "integrity_n_findings": 0,
  "errors": [],
  "parse_error": null,
  "exit_code": 0,
  "stderr_excerpt": ""
}