{
  "schema": "verifiers/ct_synthesis_quality_v1/validators/output_schema.json",
  "preflight_status": "passed",
  "preflight": [
    {
      "name": "fixture_exists",
      "path": "runs/nv_generate_ct_rflow_trusted_hash_current/skill_run",
      "status": "passed"
    },
    {
      "name": "fixture_is_directory",
      "path": "runs/nv_generate_ct_rflow_trusted_hash_current/skill_run",
      "status": "passed"
    }
  ],
  "schema_status": "passed",
  "sanity_status": "passed",
  "sanity_results": [
    {
      "check": {
        "path": "verifier.id",
        "eq": "medagent.verifiers.ct_synthesis_quality_v1"
      },
      "actual": "medagent.verifiers.ct_synthesis_quality_v1",
      "ok": true,
      "reason": "'medagent.verifiers.ct_synthesis_quality_v1' == 'medagent.verifiers.ct_synthesis_quality_v1'"
    },
    {
      "check": {
        "path": "target.skill_id",
        "contains_any_of": [
          "nv_generate_ct_rflow",
          "medagent.nv_generate_ct_rflow"
        ]
      },
      "actual": "medagent.nv_generate_ct_rflow",
      "ok": true,
      "reason": "matched 'nv_generate_ct_rflow'"
    },
    {
      "check": {
        "path": "artifact_inventory.verdict",
        "eq": "pass"
      },
      "actual": "pass",
      "ok": true,
      "reason": "'pass' == 'pass'"
    },
    {
      "check": {
        "path": "geometry_consistency.verdict",
        "eq": "pass"
      },
      "actual": "pass",
      "ok": true,
      "reason": "'pass' == 'pass'"
    },
    {
      "check": {
        "path": "image_hu_plausibility.verdict",
        "eq": "pass"
      },
      "actual": "pass",
      "ok": true,
      "reason": "'pass' == 'pass'"
    },
    {
      "check": {
        "path": "label_set_sanity.verdict",
        "eq": "pass"
      },
      "actual": "pass",
      "ok": true,
      "reason": "'pass' == 'pass'"
    },
    {
      "check": {
        "path": "overall",
        "eq": "pass"
      },
      "actual": "pass",
      "ok": true,
      "reason": "'pass' == 'pass'"
    }
  ],
  "runtime_status": "within_envelope",
  "runtime_reason": null,
  "cost_status": "skipped",
  "cost_results": [],
  "env_pin_status": "skipped",
  "env_pin_results": [],
  "factual_echo_status": "skipped",
  "factual_echo_results": [],
  "model_identity_status": "skipped",
  "model_identity_results": [],
  "runtime_integrity_status": "skipped",
  "runtime_integrity_findings": [],
  "overall_status": "passed",
  "integrity_status": "clean",
  "integrity_n_findings": 0,
  "errors": [],
  "parse_error": null,
  "exit_code": 0,
  "stderr_excerpt": ""
}