{
  "schema": "verifiers/endoscopy_tool_detection_quality_v1/validators/output_schema.json",
  "preflight_status": "passed",
  "preflight": [
    {
      "name": "fixture_exists",
      "path": "runs/holohub_endoscopy_trusted_default_pass_current3/skill_run",
      "status": "passed"
    },
    {
      "name": "fixture_is_directory",
      "path": "runs/holohub_endoscopy_trusted_default_pass_current3/skill_run",
      "status": "passed"
    }
  ],
  "schema_status": "passed",
  "sanity_status": "passed",
  "sanity_results": [
    {
      "check": {
        "path": "verifier.id",
        "eq": "medagent.verifiers.endoscopy_tool_detection_quality_v1"
      },
      "actual": "medagent.verifiers.endoscopy_tool_detection_quality_v1",
      "ok": true,
      "reason": "'medagent.verifiers.endoscopy_tool_detection_quality_v1' == 'medagent.verifiers.endoscopy_tool_detection_quality_v1'"
    },
    {
      "check": {
        "path": "target.skill_id",
        "eq": "holohub_endoscopy_tool_tracking"
      },
      "actual": "holohub_endoscopy_tool_tracking",
      "ok": true,
      "reason": "'holohub_endoscopy_tool_tracking' == 'holohub_endoscopy_tool_tracking'"
    },
    {
      "check": {
        "path": "artifact_inventory.recording_file_count",
        "gte": 1
      },
      "actual": 3,
      "ok": true,
      "reason": "3 >= 1"
    },
    {
      "check": {
        "path": "artifact_inventory.detection_artifact_count",
        "gte": 1
      },
      "actual": 1,
      "ok": true,
      "reason": "1 >= 1"
    },
    {
      "check": {
        "path": "domain_floor.verdict",
        "eq": "pass"
      },
      "actual": "pass",
      "ok": true,
      "reason": "'pass' == 'pass'"
    },
    {
      "check": {
        "path": "detection_metrics.verdict",
        "eq": "pass"
      },
      "actual": "pass",
      "ok": true,
      "reason": "'pass' == 'pass'"
    },
    {
      "check": {
        "path": "detection_metrics.tools_detected_count",
        "gt": 0
      },
      "actual": 7,
      "ok": true,
      "reason": "7 > 0"
    },
    {
      "check": {
        "path": "detection_metrics.bbox_sanity.invalid",
        "eq": 0
      },
      "actual": 0,
      "ok": true,
      "reason": "0 == 0"
    }
  ],
  "runtime_status": "within_envelope",
  "runtime_reason": null,
  "cost_status": "skipped",
  "cost_results": [],
  "env_pin_status": "skipped",
  "env_pin_results": [],
  "factual_echo_status": "skipped",
  "factual_echo_results": [],
  "model_identity_status": "skipped",
  "model_identity_results": [],
  "runtime_integrity_status": "skipped",
  "runtime_integrity_findings": [],
  "overall_status": "passed",
  "integrity_status": "clean",
  "integrity_n_findings": 0,
  "errors": [],
  "parse_error": null,
  "exit_code": 0,
  "stderr_excerpt": ""
}